{
  "schema": "coherencelattice_submission_v1",
  "title": "Demo submission: Guided vs Unguided (Local Smoke)",
  "description": "Minimal demo submission for ingest + Sophia audit.",
  "domain_tags": ["demo", "telemetry", "plasticity"],
  "guidance": {
    "unguided_label": "unguided",
    "guided_label": "guided",
    "notes": "This demo is for pipeline verification."
  },
  "runs": {
    "unguided": { "path": "runs/unguided" },
    "guided": { "path": "runs/guided" }
  }
}
